Name,Symbol,Description,Writer
Lossless,LSS,"Lossless is a tool designed to mitigate hacks for token creators. Fraudulent transactions can be frozen based on fraud identification parameters, which return stolen funds back to the account of the owner. To make the DeFi industry safe for future growth, Lossless aims to prevent and undo all upcoming hacks.",Martin
KI,XKI,"Through an ecosystem of real-life businesses, the Ki Foundation seeks to bridge the gap between CeFi and DeFi. Ki's first market offering is Klub, a platform for private investments that allows high-income individuals to allocate, store, and invest capital.",Martin
Snowbank,SB,"Snowbank DAO is a protocol on the Avalanche Network. It is a decentralized reserved currency that is backed by a group of assets. Through its staking and minting practices, Snowbank DAO enables the market to participate in economic and game-theoretic dynamics.",Martin
3X Long Ethereum Token,ETHBULL,"FTX Leveraged tokens, such as ETHBULL, are usually ERC20 & BEP2 tokens that provide leveraged positions in cryptocurrencies. Owning these tokens essentially amplifies their given price volatility. For ETHBULL this volatility is increased by 3x. For example, if the price of ETH moves up 1% your ETHBULL position will increase by 3%.",Martin
Edgeware,EDG,"With the Edgeware platform, developers can build next-generation, decentralized applications on top of a Substrate blockchain. The Edgeware platform enables the development of high-speed, low-latency, and highly efficient consensus algorithms for blockchain-based decentralized applications (DApps).",Martin
Sipher,SIPHER,"Sipher is a revolutionary play-to-earn (P2E), live-action, blockchain game with RPG elements. The title has two separate game modes (PVP and PVE) that promise meaningful end-game content, an immersive storyline, and robust classes.",Martin
BOSAGORA,BOA,"BOSAGORA's platform allows stakeholders to make democratic decisions on what projects to support, allowing for censorship resistance. The BOSAGORA team is developing Trust Contracts, which will provide an easy-to-develop, efficient, and secure way to create contracts using a language everyone can understand.",Martin
Rootkit,ROOT,"Rootkit is a DeFi protocol using a fixed supply currency in combination with a permanent liquidity lock. It, therefore, creates a mathematical price floor. The floor price represents the lowest possible price for a ROOT token that will ever exist, and there will only ever be 10,000 ROOT.",Martin
cLINK,CLINK,"cLink is a type of cToken that is distributed to users who lend assets on the Compound network. cTokens are a way for lenders to track how much they've lent, as well as the interest they've earned. A corresponding balance in cTokens is issued to each user who contributes funds to the lending pool.",Martin
dForce Token,DF,"The dForce team is advocating for the implementation of a complete suite of DeFi protocols as part of the Web3 infrastructure. These protocols include asset management, lending, trading, stakes, and bridge software. Token holders and the community jointly determine key protocol changes in this community-driven project.",Martin
Measurable Data Token,MDT,"Measurable Data Token (MDT) is a utility token whose purpose is anonymous sharing and monetization of consumer data. Data providers and data buyers can exchange data securely and anonymously using the MDT, which is a blockchain-based data economy.",Martin
VelasPad,VLXPAD,"Launched on VELAS Blockchain, the fastest AVM Blockchain in the world, VelasPad is the very first launchpad in the ecosystem. VLXPAD is a fund and development platform that has been designed with a single aim in mind: to fund and support blockchain projects of the future. Platform users have access to exclusive IDOs and Staking Rewards by using the deflationary launchpad token.",Martin
Polkadex,PDEX,The Polkadex Orderbook is a non-custodial peer-to-peer trading platform that combines both decentralized and centralized features for trading in one system. Thanks to the unique tech architecture users get the best of both worlds trading on Polkadex.,Martin
Refinable,FINE,"Refinable is the first major NFT marketplace on BSC, invested by Binance and Mr. Beast, providing individual creators and brands with an easy and affordable way to produce, discover, trade, and leverage NFTs. It is Refinable's mission to empower the next generation of digital transactions by supporting all communities in engaging with NFTs.",Martin
DexTools,DEXT,"DEXTools provides information about all of the decentralized markets in conjunction with an app and ecosystem that is meant for traders. DEXTools lets you view all blockchain data in one UI, so that you have a clear overview of your trades, investments, and the cryptocurrency market at any given moment.",Martin
Metronome,MET,"Metronome is the world's first autonomous cryptocurrency and an open-source crypto project that aims to optimize for self-governance, reliability, and portability. It was designed to be used in scenarios where reliability is the determining factor, such as a decentralized exchange of value across blockchains and advanced payment settlements. However, many communities and institutions will be able to adapt its functionality to fit their needs.",Martin
DarkCrypto Share,SKY,"DarkCrypto Share (SKY) is a part of the multi-crypto protocol DarkCrypto, based on the algorithmic coin DARK, pegged to CRO on the Cronos chain. SKY is one of the ways to measure the value of the entire protocol's trust in its ability to maintain DARK's peg to CRO. This is because during network expansion, the protocol mints DARK and distributes it proportionally to all holders of SKY tokens who have staked them in the boardroom.",Martin
PKT,PKT,"Through PKT, the world's physical bandwidth infrastructure can be scaled at a cost-effective rate. A high-speed, low-latency PKT network provides access to the internet through mesh networking while reducing costs and improving transmission speeds. Every 60 seconds, network users mint and receive PKT cryptocurrency as a reward. The goal of the network is to become the world's largest peer-to-peer ISP (Internet Service Provider).",Martin
BoringDAO,BORING,"BoradDAO is an institution that provides cross-chain services for every crypto asset. Users will receive a seamless, safe, and cost-effective transaction process when wrapping or transferring tokens. Using the BoringDAO oPortal Bridge, users will be able to send ERC-20 tokens to and from different blockchains in a safe and fast manner. USDT, USDC, and even ETH, which were originally issued on one chain, can easily be utilized in a multi-chain environment by using their underlying protocols.",Martin
Freeway Token,FWT,AuBit Freeway is a groundbreaking new asset management platform that will maximize the returns on the world's top investment products while minimizing risks. The platform offers unique platform benefits to the holders of their native utility Freeway Tokens (FWT) such as reduced fees and progressive rewards.,Martin
Unifi Protocol DAO,UNFI,"Unifi Protocol DAO offers users the opportunity to create DeFi solutions for their enterprises using the inherent security and decentralization characteristics of blockchain technology, as well as the automation of smart contracts. In this project, the Ethereum DApp and DeFi development framework is used to combine the power of several blockchains. Users will have access to multiple blockchains and an extraordinarily versatile token, allowing users to integrate the DeFi world with interoperability.",Martin
Stader,SD,"Stader gives you the greatest return on your stakes in the most convenient and safest way. As part of Stader's governance structure, the Stader token (SD) is its native token that accrues value every time it is used. In addition to building extremely modular smart contracts, Stater offers its components as a service so third parties are able to create custom solutions with our components.",Martin
Step Finance,STEP,STEP is a move-to-earn cryptocurrency that rewards users with their native tokens when they work out and stay fit. Making money and staying active has never been easier with Step! You can track your steps through their mobile app (available on both iOS and Android) and earn rewards in BNB based on how far you walk on the daily. It moreover syncs with other health apps such as Apple Health or Google Fit.,Martin
SUKU,SUKU,"SUKU is a blockchain-based ecosystem that helps creative brands and creators engage with audiences in a completely new way, both in the physical and virtual worlds. Brands and creators are able to thrive in the physical and virtual world thanks to the SUKU Ecosystem, which comprises a suite of engagement solutions.",Martin
Epik Prime,EPIK,"Epik is the leading global NFT licensing technology company with more than 300 video gaming clients. With the largest digital ecosystem featuring hundreds of the world's most popular entertainment brands, this project enables brands to integrate into video games to deliver premium digital products and experiences to over one billion players worldwide. Epik is widely regarded in the blockchain industry as the leader in offering collaborative blockchain solutions for the development of premium licensed digital collectables, cryptocurrencies and NFTs.",Martin
Aragon Court,ANJ,"Aragon Court is a platform for resolving subjective disputes that require the judgment of human guardians within the blockchain. It is built on top of the Aragon OpenStack software, and it is a plug-in arbitration platform accessible via API to decentralized applications (dApps).",Martin
HOPR,HOPR,"HOPR is a blockchain-based protocol that is aimed at solving global data and privacy concerns. HOPR aims to decentralize private data exchanges with an official initial coin offering (ICO) in 2021. In the next generation of privacy solutions, HOPR allows enterprises and private users to decide who has access to their personal and online information.",Martin
V.SYSTEMS,VSYS,"v.systems focuses on cloud and database services while providing blockchain infrastructure. Supernodes are elected in a distributed network based on Proof-of-Stake (PoS) principles, using the Supernode Proof-of-Stake (SPoS) consensus algorithm. The application provides transaction processing, smart contract creation, and mining capabilities.",Martin
YIELD App,YLD,"Users can earn high returns from DeFi products with Yield's intuitive mobile app and web platform without having to go through a lengthy, complex and, often, costly learning process. As a bank-licensed investment fund, YIELD offers a team with FinTech and cybersecurity experience. The YLD token serves as the foundation for its strategy, rewarding community members and boosting their APY.",Martin
Atari,ATRI,"The Atari Token is a decentralized cryptocurrency developed to become a standard for the interactive entertainment industry. It was developed specifically for the needs of the interactive entertainment industry by Atari Chain Ltd., a subsidiary of Atari Interactive, which is a video game and consumer electronics company.",Martin
Sentinel,DVPN,"As the first scalable framework for dVPNs, Sentinel (DVPN) reduces the carbon footprint of the network by using shared resources. Rather than launch and maintain a single consumer-facing application, Sentinel dVPN will work as a network of decentralized VPNs. With the Sentinel ecosystem, the VPN industry is set to become decentralized and 'dVPN' will be introduced to consumers.",Martin
Index Cooperative,INDEX,"$INDEX tokens, issued by Index Coop, are a decentralized, autonomous asset manager. By voting on Snapshot, your $INDEX can be used to govern the Index Coop network. In addition to earning $INDEX rewards, you can also provide liquidity on decentralized exchanges for Index Coop products.",Martin
Trias Token,TRIAS,"TRIAS stands for Trustworthy and Reliable Intelligent Autonomous Systems, a native-application-compatible execution platform, development framework, and collaborative ecosystem that supports all platforms. The project aims to define a new generation of public chain systems that are platform agnostic.",Martin
Router Protocol,ROUTE,Router Protocol is a crosschain liquidity aggregator that aims to facilitate infrastructure to seamlessly bridge between Layer 1 and Layer 2 blockchain solutions. It is designed to allow users to swap assets between different networks in a fast and cost-efficient way.,Huy
Nimiq,NIM,"Nimiq is a blockchain where users always participate automatically, instead of using a third-party node to connect to the network, such as Ethereum or Bitcoin. The goal here is to make cryptocurrencies easier to use without sacrificing decentralization.",Huy
Lazio Fan Token,LAZIO,"Lazio Fan Token, or LAZIO, is a token created by Binance with the purpose of providing ownership of the club’s governance to its holders, as well as letting them access exclusive promotions, unlock VIP rewards and gain special recognition.",Huy
PAID Network,PAID,"PAID Network is a business toolkit with an emphasis on simplifying business contracts. The traditional legal contract system forces people to rely on business counsel and to use unnecessarily complex contracts. Thus, PAID Network aims to make business contracts easy to understand and have them signed on-chain.",Huy
TerraKRW,KRT,"Terra is a network containing many stablecoins pegged to the major fiat currencies in the world. Terra KRT, for instance, is a stable asset with its value pegged to the Korean Won using algorithms to automatically expand or contract the money supply in order to maintain stability.",Huy
Reimagined Finance,REFI,"Reimagined Finance is a Farming-as-a-Service (FaaS) platform running on both Ethereum and BNB, designed to yield farms on behalf of investors. Investors simply own REFI tokens to receive yields in ETH or BNB. The share of distributions will be directly proportional to how much REFI you own (1% of total REFI supply will lead to 1% of future distributions).",Huy
Spectrum Token,SPEC,"Spectrum Protocol is a yield optimizer on the Terra blockchain ecosystem, which automatically compounds and stakes users’ rewards according to their ratio settings. Spectrum Token (SPEC) is the reward token to investors that is also automatically staked into Spectrum governance.",Huy
Inverse Finance,INV,"Inverse Finance describes itself as a ‘positive sum DeFi protocol’ that helps users maximize their earnings through revenue sharing, accumulate sustainable, high yields, and enjoy low-cost stablecoin borrowing. Inverse Finance aims to become a major financial ecosystem in DeFi, creating meaningful opportunities for everyone using innovative, DAO-owned protocols.",Huy
DarkCrypto,DARK,"DarkCrypto is the first algorithmic stablecoin pegged to CRO, using an algorithm that adjusts the stablecoin’s supply to maintain the price as close to the target price as possible.",Huy
UXD Stablecoin,UXD,UXD is an algorithmic stablecoin that is 100% backed by data neutral positions. Some of the perks of UXD are: anyone can instantly mint 1 UXD for 1 USD; UXD is censorship-resistant; the funding rate of the delta-neutral position will be distributed to stakeholders of UXD Protocol.,Huy
Aventus,AVT,"The Aventus Network enables businesses to build a second-layer protocol on top of the Ethereum network to improve scalability, cost, and speed of Ethereum transactions. The network also allows applications to work with other blockchain technologies cross-chain.",Huy
WaykiChain,WICC,WaykiChain is a public blockchain providing decentralized finance infrastructure via implementations of decentralized exchanges (DEX) and crypt-asset backed stablecoin technologies. It claims to achieve an average transaction-per-second of over 3300 with a peak of 7800.,Huy
Saber,SBR,Saber describes itself as the leading exchange on Solana for cross-chain stablecoins and wrapped assets. It allows for low-slippage trading at large volumes and maintains high capital efficiency for investors at the same time.,Huy
Hacken Token,HAI,"Hacken Token (HAI) is a cybersecurity coin from Hacken Foundation, an organization with a vision to unite all cybersecurity products Web 3.0 infrastructure.",Huy
GoChain,GO,"GoChain aims to be a network for developers to run decentralized applications with better energy efficiency than Bitcoin or Ethereum, while still being compatible with existing Ethereum wallets, smart contracts, and other tools. It does this by using a Proof of Reputation model which may consider the reputation of all network participants.",Huy
SX Network,SX,"SX Network, or SportX, is a community-owned sports betting exchange and a political prediction market. All bets are created, processed and settled on-chain, which anyone with a Web3 wallet can do. SX Network offers a level of privacy and transparency unprecedented in traditional centralized betting platforms.",Huy
pNetwork,PNT,"pNetwork (PNT) is a decentralized platform that enables the transfer of assets, NFTs as well as smart contract interactions cross-chain by using pTokens to represent assets from one blockchain on another. PNT can be staked for voting rights in pNetwork’s DAO.",Huy
Stratos,STOS,"Stratos describes itself as a ‘decentralized Data Mesh’ that provides scalable and reliable storage, database, as well as computation network, best used for scaling blockchain process capacity while maintaining decentralization.",Huy
Adappter Token,ADP,The Adappter platform aims to use the decentralization of blockchain to reward users for their contribution to the digital advertising industry and to protect their privacy by consenting to selective personal data to be used.,Huy
Apollo DAO,APOLLO,Apollo DAO is a Decentralized Autonomous Organization with a vision to build a “Warchest” that is bootstrapped by fees from their DeFi protocols and is a decentralized fund managed by veApollo stakers. The Warchest will accumulate crypto assets that benefit the growth of Apollo and stakers that provide revenue to grow the Warchest.,Huy
Atletico Madrid Fan Token,ATM,"Atletico Madrid Fan Token (ATM) is a utility token on the Socios.com platform, operating on the Ethereum blockchain. ATM can be used to give its holders a share of influence on the Atletico Madrid club decisions, as well as to get exclusive rewards and perks.",Huy
Comdex,CMDX,Comdex is a decentralized asset built on the Cosmos ecosystem with a vision to bridge the gap between CeFi and DeFi via providing access to financial products and services in the commodities space. Comdex enables the tokenization of these real-world assets with more ease than ever before.,Huy
Friends With Benefits Pro,FWB,"Friends With Benefits, FWB, describes itself as a place where “crypto meets communities”, where “technology acts as a communal connective tissue”. Members of FWB are artists, creators, rebels, thinkers and doers that work together to create a better future.",Huy
OccamFi,OCC,"OccamFi is a decentralized launchpad for the Cardano ecosystem. Some attractive features of OccamFi are: fixed price mechanics, auction mechanics for projects with non-standard value propositions, private and public pools for seed funding, community rating projects using governance features, community engagement mechanics (bounty hunting, referral system, and missions)…",Huy
AirSwap,AST,"AirSwap is a decentralized token trading network using a peer-to-peer (P2P) system, aiming to make trading tokens secure, convenient and free. AirSwap operates on the Ethereum blockchain and it offers 3 products named Instant, Spaces, and DexIndex.",Huy
vEmpire DDAO,VEMP,vEmpire DDAO claims to be the biggest decentralized investment platform for Metaverse tokens. Users can stake Metaverse tokens to earn yields both in VEMP and the original token staked. Their mission is to make sure that web3 technologies like the Metaverse can be invested in by everyone and not just the wealthy.,Huy
Lattice Token,LTX,"Lattice is an AMM-based (Automated Market Maker) decentralized exchange supporting seamless cross-chain swaps. It also supports a number of DeFi applications by using the Constellation’s Hypergraph, a near-zero fee and scalable decentralized network. Lattice offers access to a variety of features like lending, yield farming, launchpad, analytics…",Huy
ScPrime,SCP,"ScPrime uses blockchain technology to create a cloud service by paying individuals to store data around the globe, utilizing smart contracts and cryptographic proofs to maintain accuracy and security.",Huy
Taboo Token,TABOO,Taboo is an adult NFT and Streaming media project that offers exclusive contents featuring supermodels and pornstars. Taboo emphasizes on a NSFW media curation of the highest quality by being extremely selective with their adult performer hiring process.,Huy
Sandclock,QUARTZ,"Sandclock is a multichain DeFi platform that aims to make capital ultra programmable by splitting principal from yield and allowing users to create their own strategies. The range of programmability spans from investment into DCA (Dollar-Cost Averaging) vaults, zero-loss donations/subscription services, to setting up DAO to facilitate exit liquidity.",Huy
Yuan Chain Coin,YCC,"The Yuan Chain Coin takes inspiration from established crypto assets such as BTC, ETH, and integrates new innovative technologies to create a new blockchain network architecture. The YCC public chain claims to be able to process tens of thousands of transactions per second, and to both ensure the decentralization of the public chain and the property plus privacy of permitted chains.",Huy
Sora,XOR,"Sora’s mission is to create a new economic system that decentralizes the concept of a central bank. It is a network that can be used to build a parachain blockchain that connects to the Polkadot relay chain and ecosystem with built-in tools for DeFi features. The Sora network focuses on atomic token swaps, bridging tokens to other blockchains, and creating programmable rules for digital assets.",Huy
GenesysGo Shadow,SHDW,"GenesysGo offers multiple services with an emphasis on building, configuring, and maintaining RPC servers and validator nodes.",Huy
Ardana,DANA,"Ardana describes itself as a stablecoin hub, offering an on-chain asset-backed stablecoin and a stable asset decentralized exchange. The Ardana token, or DANA, is both the utility and governance token of the Ardana ecosystem.",Huy
Mute,MUTE,The Mute.io platform utilizes MUTE tokens that to make cryptocurrency trading and DeFi more accessible to mass audiences. The MUTE token allows holders to participate in governance and earn fees from platform revenue.,Đức
ADAPad,ADAPAD,"Cardano ecosystem's first deflationary launchpad is ADAPad. With the upgrade called Alonzo, the Cardano ecosystem will be able to use smart contracts and decentralized finance (DeFi).
",Đức
Ternoa,CAPS,"The Ternoa Application enables the creation of ""Time Capsules"" which are non-fungible tokens issued on the Ternoa Blockchain. These technologies help to encrypt, store, and transfer data in a secure way. Time capsules, containing personal information, can be passed from generation to generation.",Đức
Permission Coin,ASK,"The leading provider of permission advertising for eCommerce is Permission.io. Permission.io and third-party e-commerce platforms are powered by the ASK Coin, which allows individuals to grant permission to use their data securely and monetize it. Consumers are rewarded with ASK when they interact with brands and content, building loyalty and trust.",Đức
DogeBonk,DOBO,"Based on the Binance Smart Chain, DogeBonk is a ""fluffy token"" with automatic yield generation and deflationary properties. The DogeBonk 5% tax applies to every transaction which is then distributed to other DogeBonkers for merely holding their tokens. To generate an ever rising price floor, another 5% tax is automatically added to the locked liquidity pool.",Đức
Tokenlon,LON,"Based on Ethereum blockchain technology, Tokenlon is a decentralized exchange and payment settlement protocol. By providing a secure, reliable, and smooth trading experience, Tokenlon DEX hopes to cater to the needs of the masses. LON serves as a utility token that aligns ecosystem stakeholders and encourages the expansion of the ecosystem.",Đức
SpiritSwap,SPIRIT,"Spiritswap Token is an exchange token that operates on the Spiritswap DEX. Spiritswap allows users to trade, farm, and stake, with more functionalities being developed.
",Đức
SwapXI Token,SWAPXI,"Built on the Avalanche blockchain, SwapXI is a new unique social token that is responsible for implementation, value creation, and financial settlement of the SwapXI ecosystem. By creating a payment platform in synchronisation with streamers, viewers, and advertising companies, SwapXI provides a unique added value for the entertainment community.",Đức
0chain,ZCN,"0Chain is a platform for decentralized storage that provides data privacy, security, and private sharing. 0Chain assists businesses to become compliant with GDRP (General Data Protection Regulation) and CCPA (California Consumer Privacy Act) and gaining transparency with zero liability.",Đức
dotmoovs,MOOV,"Sports performance will be revolutionized with Dotmoovs, a remote peer-to-peer sport competitive platform. With a simple video taken with a smartphone, Dotmoovs is able to score sports tricks and movements with an AI algorithm. Dotmoovs wants to change the world of sports competition by displaying NFTs of popular athletes and allowing players to monetize their skills. ",Đức
