Name,Symbol,Description,Writer
Ellipsis,EPS,Elipsis is a decentralized exchange that allows users to swap stablecoins on Binance Smart Chain with minimal fees and low slippage.,Đức
Dero,DERO,"Dero is the first crypto project to combine a proof-of-work blockchain with an anonymous blockchain structure and DAG blocks. In comparison to existing privacy coins like Monero (XMR) or Z-Cash (ZEC), it is designed to offer a radical improvement. In order to achieve this, Dero intends to combine the best of both consensus mechanisms.
",Đức
JasmyCoin,JASMY,"JasmyCoin is an ERC-20 token. JasmyCoin can also be used to prove value exchange or payment for services by an unspecified number of individuals and businesses. As the token's functionality is not limited, it can be used for a variety of purposes.",Đức
Marlin,POND,"Known as a DeFi/Web 3.0 network, the Marlin open protocol provides a high-performance programmable infrastructure. MarlinVM, run by the nodes in the Marlin network, called Metanodes, provides a virtual router interface for developers to perform edge computations and deploy customized overlays.",Đức
Magic,MAGIC,"MAGIC is the governance token for Cosmic Universe, an MMORPG that uses the Harmony blockchain to develop a play-to-earn system. In Cosmos Universe, players have full ownership of their NFT characters, their own lands, and the play-to-earn concept is integrated into the entire environment.",Đức
GXChain,GXC,"The GXChain blockchain is a fundamental technology for building a trusted, global data economy. GXChain benefits from DPoS-based Graphene underlying architecture. Furthermore, it possesses G-ID, GVM, BaaS, and Blockcity features, which are convenient for developers of applications. GXChain develops multiple data modules based on decentralization, cryptography, and smart token design.",Đức
SingularityNET,AGIX,"The SingularityNET platform is a full-stack AI solution powered by a decentralized protocol that allows AIs to work together at scale and eliminates one of the major obstacles to AI growth today - a lack of interoperability that severely limits individual AIs' abilities. Any individual can use SingularityNET to access a network of AI algorithms, services, and agents.",Đức
Dawn Protocol,DAWN,"Dawn is the new blockchain of the currently existing FirstBlood platform. The protocol is open-source and aimed at gaming and competitions. No matter which country or background users come from, its mission is to enable a fair, open, and rewarding gaming ecosystem. In order to reward players, game developers can seamlessly integrate the open protocol into their games.",Đức
GPEX,GPX,"Through cross-chain compatibility and inter-chain technology, the GPEX wallet enables fast payment transfers to partner platforms. The GPEX Wallet allows users to transfer unused loyalty points, reward points, airline miles, store points, etc. (collectively, ""Brand Points""). Additionally, the wallet supports other partner tokens for their games, as well as an internal stablecoin GPX.",Đức
Qredo,QRDO,"Qredo is reimagining ownership and connectivity of digital assets. By pioneering the first decentralized trustless multi-party computation (MPC) custodial network, Qredo is bringing liquidity and capital efficiency to the blockchain economy. In addition to decentralized custody and native cross-chain swaps, this advancement enables Qredo to offer cross-platform liquidity access.",Đức
flexUSD,FLEXUSD,"The FlexUSD stablecoin is pegged to the US dollar. The currency pays holders interest automatically, making it unique among stablecoins.",Đức
Proton,XPR,XPR is a public blockchain platform and smart contract platform that combines consumer apps with peer-to-peer electronic payments. It emphasizes a high level of identification security and financial settlement.,Đức
KardiaChain,KAI,"Kardiachain is a public blockchain platform focused on technologies, infrastructure, and solutions focused on enterprise and government applications in Vietnam and other countries in South & East Asia.",Đức
Shiba Predator,QOM,"In the Shiba ecosystem, QOM is the Shiba Predator. It aims to flip the Shiba Market Cap. It is a decentralized, spontaneous experiment in community building.",Đức
Strike,STRK,"Strike is a DeFi lending platform that allows users to deposit cryptocurrencies into one of several markets supported by the platform and earn interest on them. In return for a user's token deposit to a Strike market, the user receives STRK tokens.",Đức
PlatON Network,LAT,"LatticeX Foundation created and operates PlatON, the next-generation Internet infrastructure protocol that is based on blockchain technology and supported by the privacy-preserving computation network. PlatON’s core feature is “Computing interoperability”.PlatON Network's native token is LAT, a cryptocurrency is based on the Ethereum platform.",Đức
Decentral Games,DG,"A 3D metaverse casino built in Decentraland, Decentral Games is the first-ever metaverse casino owned by its users. Through the play-to-earn metaverse poker game (ICE Poker) operated by Decentral Games, the DG Treasury receives revenue from NFT mints, royalties on secondary sales, activations, and upgrades.",Đức
DODO,DODO,"Powered by Ethereum and Binance Smart Chain, DODO operates as a decentralized exchange platform. With high-capital-efficient liquidity pools, it supports the single-token provision, reduces impermanent losses, and minimizes slippage.
",Đức
Stargaze,STARS,"The Stargaze network is a decentralized and community-owned network. Using Tendermint as the consensus engine, it is built as an app-specific Cosmos Proof-of-Stake chain. The project aims to be similar to OpenSea, but with community control via a curation and protocol DAO.
",Đức
RSK Infrastructure Framework,RIF,"RIF (Rootstock Infrastructure Framework) is the third layer of Bitcoin-based infrastructure offering a wide range of features, such as payments, storage, and domaining (RNS). These services are provided by a tech stack, short for Blockchain Technology Stack, that requires the RIF token to access.",Đức
AIOZ Network,AIOZ,"AIOZ Network (AIOZ) is an Ethereum token that allows Ethereum and Cosmos to operate together over Layer 1 blockchains. Aioz Network aims to enable instant execution and low transaction fees for applications such as file storage, live streaming, content delivery, etc.",Đức
FEG Token BSC,FEG,"FEG token BSC offers a multi-chain exchange for all. With one interface, many features can be accessed, including trading, wrapping, staking, and lending.",Đức
Wilder World,WILD,"Powered entirely by NFTs, Wilder World is an immersive 3D universe. Wilder World aims to create a virtual world where users can roam freely, obtain virtual land, and purchase unique NFTs through a collaboration with Zero.Space.
",Đức
Everipedia,IQ,"IQ Network from Everypedia is the first encyclopedia in the world where anyone can become a member and receive rewards and accolades for curating. Everipedia has a vision of bringing blockchain knowledge to the world and bringing information to the blockchain, validating facts in an era of misinformation, and unlocking a new class of use cases for the blockchain space.",Đức
Wrapped Centrifuge,WCFG,"WCFG (Wrapped Centrifuge) is an Ethereum token that represents CFG (Centrifuge) on the Ethereum blockchain. WCFG is not CFG, but a separate ERC-20 token created to track the price of CFG.",Đức
BTC Standard Hashrate Token,BTCST,"Binance Smart Chain (BSC) launched the Bitcoin Standard Hashrate Token (BTCST). The collateral is Bitcoin (BTC) hashrate, with each token representing 0.1 TH/s of Bitcoin mining power at 60 W/TH efficiencies. In exchange for freshly minted BTCST tokens, miners provide their computational power to the platform. Ultimately, BTCST’s goal is to connect liquidity and Bitcoin’s mining market.",Đức
DEAPCOIN,DEP,"DEA Project, a blockchain-based NFT DeFi platform featuring NFTs, games, and other forms of entertainment, is being developed by Digital Entertainment Asset limited, headquartered in Singapore. In the NFT Marketplace, DEP can use DEAPcoin, the ERC-20 utility token for DEP, to purchase NFTs (ERC-721) in order to enhance gameplay.",Đức
Iron Bank EURO,IBEUR,"CREAM's Iron Bank serves as the protocol-to-protocol lending platform and liquidity back end for the entire DeFi ecosystem. Currently, peer-to-peer money markets such as Cream v1 are available. ",Đức
Aavegotchi,GHST,"As a non-fungible token (NFT) built on the Aave protocol, Aavegotchi (GHST) is a DeFi-oriented project. Essentially, Aavegotchis are game avatars that can be staked to earn rewards as DeFi collateral.",Đức
Sperax,SPA,"Software products based on the Sperax protocol are developed by Sperax, an open-source group. The Sperax stablecoin (SPA) and a suite of DeFi apps are all built on top of Sperax token (SPA). With its original BDLS consensus protocol and dual stablecoin system, Sperax aims to offer decentralized financial services to everyone.",Đức
Orion Protocol,ORN,"A decentralized platform that aggregates liquidity from multiple crypto exchanges, the Orion Protocol provides a single point of entry into the entire digital asset market without requiring custodial access. Unlike most crypto exchanges, Orion is designed to solve the problem of profitable transactions being difficult due to a lack of liquidity.",Đức
Adshares,ADS,"Advertising space in the Metaverse is monetized by AdShares, a Web3 protocol. Metaverse, blockchain games, NFT exhibitions, and website advertising are all available on AdShares’ platforms. It provides low rates, 100000 transfers per second, and a revenue-sharing model among token holders.",Đức
Alchemix,ALCX,"A DeFi protocol known as Alchemix allows depositors to create synthetic tokens which can represent the future yield of a deposit. With Alchemix,  in exchange for temporary deposits of stablecoins, users can retrieve a near-instant tokenized value.",Đức
My Neighbor Alice,ALICE,"The game My Neighbor Alice uses blockchain technology to allow players to create and own virtual islands, build items, and meet new people. As part of the traditional gaming market, My Neighbor Alice aims to introduce blockchain technology to millions of players.",Đức
Beldex,BDX,"BChat, BelNet, the Beldex browser, the Beldex privacy protocol, and the Beldex bridge are among the privacy-first decentralized applications that make up the Beldex ecosystem. BDX, the privacy coin of Beldex, is a utility that enables privacy preservation in decentralized applications.",Đức
FUNToken,FUN,"As an online gaming operator and player, FunFair offers blockchain-powered solutions that are increasingly relevant to both. Using Ethereum technology, FunFair provides low-cost, high-quality, transparent, and provably fair online casino experiences.
",Đức
Kirobo,KIRO,Kirobo is a start-up from Israel whose sole purpose is to create a logic layer that sits on top of every blockchain and protects users from human errors. The ultimate goal of Kirobo is to make blockchain as user-friendly and secure as internet banking.,Đức
Spookyswap,BOO,"In the Fantom Opera network, SpookySwap is a decentralized exchange (DEX) for automated market-making. In contrast to other exchanges, SpookySwap is focused on building a solid foundation by utilizing BOO tokens for governance, diverse farms, a built-in bridge, and limit orders.",Đức
TomoChain,TOMO,"Using Proof-of-Stake Voting consensus, Tomochain is a scalable blockchain used commercially by companies worldwide. By using technology to mask the friction of Blockchain, they aim to accelerate onboarding for millions of users while keeping its underlying benefits.",Đức
Seedify.fund,SFUND,"Seedify.fund (SFUND) is an incubator and launchpad for blockchain gaming that provides fund-raising, community and partnership building, and full support to help drive the future of gaming. Seedify NFT Space is the industry's first NFT marketplace centered on gaming and metaverse assets. The platform also includes an NFT launchpad for game assets and metaverse assets.",Đức
KILT Protocol,KILT,"KILT is a decentralized blockchain identity protocol designed to facilitate the issue of verified, revocable, and anonymous claims-based credentials with Web 3.0. The mission of KILT is to help people regain control over their data, restore their privacy, and let them implement innovative business models around credentials and identity.",Đức
Utrust,UTK,"Utrust offers instant transactions and immediate crypto-to-cash settlements to merchants through their digital currency payment solution with the same name, which helps modernize the finance and payment industry.",Đức
FEG Token,FEG,Decentralized finance is being restructured by FEG. FEG is reshaping and enhancing DeFi's most extensively needed advancements through developing the most robust ecosystem ever built for the DeFi platform.,Đức
Hoo Token,HOO,"The Hoo Token is the platform pass of Hoo, abbreviated as HOO, and is a decentralized blockchain digital pass that is based on Hoo Smart Chain (HSC) and Ethereum. Hoo has created a development path that combines DEX+CEX with Hoo characteristics. In addition to being the only shared asset of the entire platform ecology, HOO is also the most important link for realizing capital flows and governance mechanisms.",Đức
Metal,MTL,"The Metal (MTL) currency is the native currency of Metal products, a crucial component of the Metal ecosystem. Using Metal Pay, you can instantly send and receive any cryptocurrency to friends. With MTL, cryptocurrency payments are fast and easy, and there are no fees to send, receive, buy, or sell.",Đức
Verasity,VRA,"Video-sharing platform Verasity (VRA) aims to create a fair system for creators to be paid for their work as well as advertisers to gain value for their ad spend. Verasity achieves this through its proof-of-value (PoV) protocol, product layers, and its esportfightclub.com platform - a pro-gaming streaming platform specifically designed to play host to esports tournaments such as PUBG Mobile, Verasity's biggest use case.",Đức
Wonderland,TIME,"The Olympus DAO fork Wonderland is one of the most popular and successful forks. On Avalanche, it was the first protocol of decentralized reserve currencies. Unlike Magic Internet Money and liquidity tokens, TIME is backed by a variety of reserve assets.",Đức
district0x,DNT,The district0x Network has decentralized autonomous organizations - districts - that act as marketplaces and communities. Every internet citizen will be able to connect to and deploy districts on the network without charge for the rest of their lives.,Đức
Beefy.Finance,BIFI,"The Beefy.Finance platform enables users to earn compound interest on their crypto holdings by creating a proprietary, decentralized, multi-chain yield optimization algorithm. In the DeFi ecosystem, Beefy.Finance optimizes user rewards by automatically implementing a set of investment strategies backed by smart contracts for liquidity pools, automated market making, and other yield farming opportunities.",Đức
Veritaseum,VERI,"Veritaseum tokens enable financial transactions and trades without the involvement of third parties. As an ERC20 token, VERI tokens utilize the Ethereum platform and are exposed to a range of other crypto assets.",Đức
Electroneum,ETN,"The main purpose of cryptocurrency Electronium is to make it easier for users to use and accessible to a large audience. Mobile applications and mobile phones are used to develop the project, in which users can mine digital money and invest it for themselves.
",Đức
Covalent,CQT,"Across all blockchain networks, Covalent provides a unified API for full visibility and transparency of assets. With just a few lines of code, it allows you to get detailed, granular blockchain transaction data from multiple blockchains.
",Đức
Dvision Network,DVI,"Along with being a blockchain-based, virtual reality content ecosystem, Dvision Network also powers the NFT marketplace within it. Humanity can enjoy an affluent life in a virtual reality world in the fourth industrial revolution presented by Dvision Network. Dvision has 3 important platform pillars, an NFT marketplace (VR-Market), Tailored Virtual Reality (VR-Space), and Collection of VR-Spaces (VR-City).",Đức
ZoidPay,ZPAY,"In addition to being a crypto liquidity platform, ZoidPay also enables instant card issuance for web 3.0 financial services. Using Zoidpay, you can shop anything with your digital assets from anywhere in the world.",Đức
Bitcoin Diamond,BCD,"BCD (Bitcoin Diamond) is a hard fork of Bitcoin. During block height 495866, a fork was implemented that introduced a new proof of work algorithm to decrease the likelihood of attacks on the network, as well as segregation of signatures for transactions on the chain to increase the number of transactions per second on the network.",Đức
Bounce,AUCTION,"A decentralized auction platform, Bounce integrates liquidity mining, decentralized governance, and stake mechanisms. A key principle of Bounce is the scarcity of resources, which creates an environment of competition for resources. In Bounce, tokens and other assets like NFTs are provided in a competitive environment.
",Đức
JPEG'd,JPEG,"JPEG'd is a protocol that will be used in the NFT space for music royalties and albums in the future. Unlike other governance tokens, JPEG has no economic value. It serves solely as a utility token for protocol governance.",Đức
Bitrue Coin,BTR,"The native asset of the Bitrue Exchange is Bitrue Coin (BTR). With BTR, Bitrue is able to support all of its current business models, including trading fee deductions, cash deposits by projects, voting for listings, wealth management programs, and loan programs.",Đức
CertiK,CTK,"CTK is primarily used as a utility token. Therefore, it powers the CertiK ecosystem in a very important way. For instance, users of the platform can use the token to make payments and settle their accounts.",Đức
XMON,XMON,XMON's native token is XMON. XMON is a blockchain-based project that uses artificial intelligence to create pixel horror.,Đức
cUNI,CUNI,The CUNI token is the native token of the Compound protocol. It is a disaggregated interest rate protocol that will enable developers to enjoy a world of open financial applications. The Compound protocol aims to revolutionize access to credit.,Đức
DEI Token,DEI,"With one native bridge that connects all chains within the DEUS ecosystem, DEI is an advanced algorithmic cross-chain fractional reserve stablecoin. The mission of DEI is to bridge liquidity across all blockchains in a decentralized and scalable manner. Using DEI, users will be able to send stablecoins to any chain and claim them on the other side.
",Đức
Kava Swap,SWP,"Kava Swap™ is a decentralized cross-chain Autonomous Market Making (AMM) protocol for natively exchanging assets between the largest assets in the world. In addition to low fees and high efficiency, Kava Swap™ provides strong returns for liquidity providers.",Đức
IDEX,IDEX,"IDEX is a hybrid liquidity depository exchange (DEX) combining an order book and an automated market maker. This hybrid model combines the performance, security, and liquidity of AMMs with the benefits of traditional order book models.",Đức
Karura,KAR,"Karura is an EVM-compatible, scalable, and DeFi-optimized network founded by the Acala Foundation. Among the platform's offerings are a staking derivative (liquid KSM), a stablecoin backed by cross-chain assets (kUSD), and an AMM DEX - all with micro gas fees that can be paid in any token.
",Đức
Augur,REP,"Built on blockchain technology, Augur is a decentralized prediction market platform. Through Augur (REP), owners of the Ethereum-based Reputation token can harness the wisdom of the crowd through prediction markets. A user can, according to these markets, make bets on the outcome of events such as company performance, election results, or even natural phenomena by buying shares that bet either on or against the proposed outcomes.",Đức
Adventure Gold,AGLD,"Adventure Gold (AGLD) is an ERC-20 native token included in Loot non-fungible tokens (NFT) project. In Loot, randomized adventures gear is generated and stored in the blockchain.",Đức
Clover Finance,CLV,"Clover Finance (CLV) is a blockchain infrastructure platform built on Polkadot for DeFi applications which aims to be cross-chain and cross-chain compatible. Clover Finance transactions are financed with the CLV token, and network upgrades are voted on with it. In addition to enabling interoperability between Bitcoin and other blockchains, Clover Finance envisions reducing friction between the two.",Đức
Aave [OLD],LEND,"Aave is a decentralized finance protocol that lets people lend and borrow crypto. Digital assets are deposited into special liquidity pools where lenders earn interest. Through this liquidity, crypto can then be used as collateral for flash loans. LEND is an Ethereum-based token on Aave which provides discounts on deployment fees, holders of LEND receive discounted fees on the platform, and it serves as a governance token.",Đức
Wanchain,WAN,"The Wanchain distributed ledger enables cross-chain transactions and multi-chain interoperability. Wanchain facilitates transactions between blockchains, but it also runs autonomously as a standalone blockchain. Transactions between chains are recorded and processed with the protocol acting as a distributed ledger.",Đức
HUNT,HUNT,"In order to empower users of the HUNT DAPP, the HUNT token serves as the key currency. It can be used directly in every DApp, or it can be used as a vehicle token to carry out different functions.
",Đức
Hermez Network,HEZ,Hermez is a decentralized ZK-rollup designed to scale payments and token transfers on the Ethereum network to greatly reduce transaction costs and support community projects through its Proof-of-Donation mechanism.,Đức
Regen,REGEN,The Regen Network Platform token is REGEN coin. Managing regenerative landscapes in harmony with ecosystems and economics is at the heart of Regen Network's approach.,Đức
Ion,ION,"ION is an open, public, permissionless Layer 2 Decentralized Identifier network built on top of the Bitcoin blockchain.",Đức
Badger DAO,BADGER,"In order to bring Bitcoin into Ethereum, Badger DAO aims to create an ecosystem of DeFi products. Unlike previous DeFi projects that used Ethereum as the main reserve asset, this is the first project to use BTC. As part of the launch, Sett and DIGG will be the main products.",Đức
ThunderCore,TT,"Public blockchain ThunderCore is a secure, high-performing, EVM-compatible, and cross-chain interoperable. The platform enables decentralized applications to create an even more hyperconnected world.
",Đức
BENQI,QI,"Avalanche-based BENQI is a decentralized, non-custodial liquidity market protocol. In addition to lending, borrowing, and earning interest with digital assets, the protocol allows users to exchange assets seamlessly. While depositors provide liquidity for the protocol, borrowers are able to borrow in over-collateralized ways.",Đức
Bonfida,FIDA,"Bonfida is a comprehensive suite of products that bridges the gap between Serum and Solana. Serum GUI is the flagship of Solana's Data Analytics and brings its first-of-its-kind technology to the field.
",Đức
Sifchain,EROWAN,"Sifchain is a solution for DEXes that combines multiple chains. Sifchain is aiming for greater performance, enhanced cryptoeconomics for trading and security, and an extensible roadmap for Omni-chain, as well as true DAO governance in the future.",Đức
Phantasma,SOUL,"Phantasma is an open-source, decentralized blockchain platform with a rich set of features. This innovative project boasts an advanced eco-friendly smartNFT technology, dual token system, sustainable tokenomics model, and innovative staking mechanism. Chains such as this one are designed for the creation of digital goods and services, including communications, entertainment, marketplaces, and on-chain storage solutions for dApp developers and enterprise clients.
",Đức
Cult DAO,CULT,"The CULT token is tradable and liquid, and CULT transactions contribute to the CULT DAO protocol by funding investments into decentralized technologies by filling the treasury slowly.
",Đức
AllianceBlock,ALBT,"The AllianceBlock Protocol is a decentralized, blockchain-agnostic layer 2 that automates the conversion of any digital or crypto asset into a bankable financial product by bridging traditional and decentralized finance.",Đức
SafePal,SFP,"SafePal is dedicated to providing its users with a simple, secure, and convenient crypto management platform to store and grow their crypto assets. As the first hardware wallet invested and backed by Binance, SafePal is readily available for use. SafePal Token is a utility token that powers the entire SafePal ecosystem, which is short for SafePal Token.",Đức
Gitcoin,GTC,"The Gitcoin community refers to itself as a community of builders, creators, and protocols joined together to develop the open internet's future. Gitcoin fosters the development of open-source projects by providing infrastructure for Web3 development - including tools, technologies, and networks.
",Đức
Automata,ATA,"Automata is a high-performance computing protocol that provides privacy-first, high assurance, and frictionless transactions for Web 3.0 applications and businesses. A seamless Web 3.0 experience is its mission, so it provides the functionalities and infrastructure needed to make it happen. It focuses on censorship, a lack of transparency in data ownership, and invasion of privacy.",Đức
