Name,Symbol,Description,Writer
Bitcoin,BTC,"Created in January 2009, Bitcoin is the first decentralized cryptocurrency. Bitcoin serves as a completely digital payment system without any central authority taking part in the process. Bitcoin uses cryptography to keep itself secure, and Bitcoin transactions can be transparently viewed on the blockchain. In addition, the total supply limit of Bitcoin will stop at 21 million coins.",Huy
Ethereum,ETH,"Ethereum is a smart contract platform powered by its native currency: ETH, also called Ether or Ethereum. Because Ethereum allows decentralized applications (DApps) to be built on its blockchain, its network empowers from decentralized finance (DeFi) applications, non-fungible tokens (NFTs) to blockchain games.",Huy
Build 'N Build,BNB,"Initially created as an ERC20 token on the Ethereum network, BNB is now a native token gas token that powers the BNB chain. BNB can also be used as transaction fees on the Binance Exchange, to trade with other cryptocurrencies, to book travel arrangements, buying virtual gifts or to be used as collaterals for loans on numerous platforms. They recently rebranded the chain name to ""Build 'N Build.""",Huy
XRP,XRP,"XRP is a digital asset which bridges two different currencies quickly and efficiently. XRP is the native currency of XRP Ledger, a blockchain-based, open-sourced, distributed protocol that has a transaction speed of 3-5 seconds. The company behind XRP is known as Ripple, who claims to offer “secure, instantly and nearly free global financial transactions of any size with no chargebacks"".",Huy
Cardano,ADA,"Cardano is a smart contract platform whose foundation focuses on a science-based approach. Their papers are peer-reviewed by experts internationally to validate their method. Cardano, moreover, uses the Ouroboros POS system which divides time into epochs, thus increasing scalability. In addition, the Cardano network divides itself into subnetworks to handle more transactions. It is currently deploying its first smart contracts to compete with other layer 1 protocols.",Huy
Solana,SOL,"Solana is a blockchain created to host decentralized, scalable applications. The strength of Solana is that it can process many more transactions per seconds than Ethereum and it also charges lower transaction fees. Additionally, Solana utilizes both proof-of-stake (PoS) and proof-of-work (PoW) models.",Huy
Avalanche,AVAX,"Avalanche is an open-sourced, smart contract blockchain that focuses on transaction speed, eco-friendliness and scalability. Due to its unique structure enabling subnets for each protocol on the chain, Avalanche is by far one of the fastest layer one chains in the crypto universe.",Huy
Terra,LUNA,"Terra LUNA is the most successful chain which powers the algorithmic stablecoin known as UST. LUNA itself is the other native token of the open-sourced blockchain known as Terra. LUNA is a cryptoasset with many functions: It's primary use besides being tradeable is it can be used as collateral for the Terra economy or used for governance and mining. Unlike other layer one protocols, Terra LUNA enables transactions to be paid in multiple coins (a unique feature other chains have not followed upon). ",Huy
Polkadot,DOT,"Polkadot is a network with multiple blockchains where users can transfer every type of data and asset—including tokens, DApps…—from one blockchain to another. Spreading transactions across many parallel blockchain also improves scalability.",Huy
Dogecoin,DOGE,"Originally created as a joke, Dogecoin works as a decentralized, peer-to-peer digital currency. It is considered the first ‘meme coin’ and has gathered for itself a large community of fans and investors. Dogecoin’s success is in great parts thanks to the endorsement of Reddit and Elon Musk.",Huy
Shiba Inu,SHIB,"Shiba Inu is an Ethereum-based token that is referred to by some as the ‘Dogecoin killer’. The token is “an experiment in decentralized spontaneous community building”, which means the project started from zero without a preassembled team or direction, and it’s 100% up to the community to build something out of it.",Huy
Polygon,MATIC,"Polygon is a layer 2 scaling solution working on top of the Ethereum blockchain. What Polygon brings to the table is faster and lower-cost transactions than Ethereum, and these transactions are also irreversible on the Ethereum mainchain.",Huy
Cronos,CRO,"Cronos is the utility token of Cronos EVM Chain and Crypto.org Chain. The Cronos EVM Chain supports DeFi apps and allows users to port smart contracts and DApps from Ethereum and all EVM compatible chains. Crypto.com itself offers many services like wallet and card app, MCO Visa card,... with the purpose of accelerating the transition of the tradfi economy  into the native cryptocurrency landscape.",Huy
Litecoin,LTC,"Litecoin is a decentralized internet currency founded 2 years after Bitcoin by former Google engineer Charlie Lee. Litecoin is used to transfer payment around the world with near-zero cost and fast transaction speed. Although it has lagged in development of other chains, it recently deployed an upgrade with the privacy oriented Mimble Wimble which gives it equal footing with other chains dedicated to anonymous transactions.",Huy
Cosmos,ATOM,Cosmos is dubbed an “Internet of blockchains” by its founding team. It aims to use open-source tools to streamline transactions between different crypto networks. Cosmos focuses on customizability and interoperability with a goal to create an ecosystem of decentralized networks. Cosmos’s own PoS blockchain is called Cosmos Hub and is powered by ATOM. Many other chains have used the Cosmos SDK to buid out their own networks and is considered a layer zero chain in many theoretical circles.,Huy
Chainlink,LINK,"Chainlink acting as a price oracle provides real-world data to smart contracts. Since most smart contracts can’t execute their terms without relying on external data sources, Chainlink incentivizes data providers to act as a bridge between the two. There are reputation scores and rewards assigned to each provider to further encourage them to provide accurate and useful data.",Huy
Near Protocol,NEAR,"NEAR protocol is a proof-of-stake (PoS) layer 1 blockchain that utilizes a sharding solution called ‘Nightshade’. This solution only lets each node to store a small subset of the platform’s data, which reduces potential points of failure security-wise. NEAR protocol also includes ‘Rainbow Bridge’, an application that lets users easily transfer Ethereum tokens to NEAR and vice versa.",Huy
Tron,TRX,The Tron blockchain has 3 layers to its architecture: the Core layer sends coded instructions to the Tron Virtual Machine; the Application layer lets developers create wallets and applications powered by TRX; and the Storage layer stores records of the blockchain’s history and status of smart contracts.,Huy
FTX Token,FTT,"FTT Token is the native token of the FTX exchange, which is a centralized cryptocurrency exchange focused on derivatives, volatility products and leveraged products. FTX can be used as collateral, to get discounts on trading fees and more.",Huy
Algorand,ALGO,"# Algorand Market Analysis

![Algorand went live in 2019](https://images.surferseo.art/70c51dee-3f6b-420c-ae15-1c69225458b6.jpeg)

## What is Algorand?

Going live in 2019, Algorand is a layer 1 decentralized blockchain technology that uses the Pure Proof of Stake (Pure PoS/ PPoS) consensus protocol and ALGO is its native currency. Algorand claims to be the best solution for solving the blockchain trilemma: achieving decentralization, scalability, and security.

The name comes from Algo (algorithm) and Rand (random): an algorithm that uses randomness to enhance the consensus mechanism. Algorand is primarily targeting the smart contract niche, with an emphasis on financial services, decentralized finance (DeFi), financial securities markets, and all sectors related to the future of finance.

## What is the Pure Proof of Stake Consensus Protocol?

Pure Proof of Stake (PPoS) is the conception of Algorand founder MIT professor Silvio Micali and is argued to lead to a more decentralized network compared to the existing Proof of Stake (PoS) protocol and be more resource efficient than Proof of Work.

In PPoS, validators are chosen to participate based on both the number of coins they own, but also through random selection, regardless of the size of their position.

This random selection of a 'committee' (participants that can add blocks to the network) is carried out by what Miclai describes as the 'secret sauce' of Algorand; Cryptographic Sortition. We can visualize Cryptographic Sortition as a weighted lottery, with each ALGO held acting as the lottery ticket. Due to the selection of the committee member being unpredictable, it is not possible to control them in advance, leading to a more secure network. And having a wider pool of participants to choose from also leads to greater decentralization. Cryptographic Sortition has been adopted by other next-generation blockchains like [Cardano](https://coinrotator.app/coin/cardano), will full credit given to Silvio Micali's protocol.

![Algorand claims to solve the Blockchain Trilema](https://images.surferseo.art/479465d1-7f29-4712-a1bc-276c6d2d8dc5.jpeg)

##   
What Problem Does Algorand Solve?

Thanks to the PPoS protocol which allows for high transaction throughput, the Algorand blockchain is hoping to be the preferred chain for Defi, as well as the exchange of digital property or NFTs. Algorand also bills itself as the ‘greenest’ blockchain. Since 2021, Algorand has been ‘carbon neutral’; a portion of the transaction fees goes towards the purchase of Carbon Credit, which offsets its carbon emissions.

### Algorand State Proofs

Algorands recent protocol upgrade saw the introduction of Algorand State Proofs (ASP); Algorands new interoperability standard that allows interoperability with all Proof-of-Stake blockchains. Previous solutions to the interoperability problem relied on trusted intermediaries like centralized bridges or validator networks. These create single points of failure or attack vectors that allow malicious parties to compromise the system. ASPs allow the creation of a low-powered, lightweight 'snapshot' of the 'state' of the blockchain (current balances, transactions, or application data) to be read by the interoperated blockchain. Due to their low-powered nature, they can be used in environments such as a phone, smartwatch, or inside a smart contract. All Proof-of-Stake blockchains will be able to use State Proofs. State Proofs will be generated with advanced **Falcon Keys**, which ensures security even when faced with an attack from advanced Quantum Computers.

![MIT professor Silvio Micali founded Algorand](https://images.surferseo.art/c0a481b0-23fd-4150-b6c2-fc81256d3e52.jpeg)

## Who is the Team Behind ALGO?

The powerhouse behind the creation of the Algorand network is MIT professor Silvio Micali, who has a very high standing in the cryptocurrency and blockchain space. He has over 40 years of expertise behind him and has contributed to some of the most well-known cryptocurrency advancements including public-key cryptosystems, pseudorandom functions, digital signatures, and oblivious transfer, and is one of the co-inventors of Zero-Knowledge Proofs and Verifiable Random Functions, which have been adopted by many third generation blockchains such as [Ethereum](https://coinrotator.app/coin/ethereum), [Cardano](https://coinrotator.app/coin/cardano), and [Polkadot](https://coinrotator.app/coin/polkadot).

He has gone on to receive many rewards such as the Gödel Prize, the RSA Award for Excellence in Mathematics (2004), and the Turing Award (2012) for his work in the field of cryptography. He is a member of the National Academy of Sciences, the National Academy of Engineering, the American Academy of Arts and Sciences, and a fellow of the International Association for Cryptologic Research.

In the senior leadership team, Micali is joined by interim CEO W.Sean Ford, the previous CMO for LogMeIn. He brings expertise in brand leadership, product marketing, global marketing strategy, and e-commerce. Paul Riegle joined Algorand from Carbon Black where he led product management for initiatives that produced over $200million in recurring revenue.

## Road Map and Future Plans for Algorand (ALGO).

Algorand doesn’t technically have a roadmap but upcoming milestones can be ascertained from interviews, presentations, and publications from the Algorand team.

In July 2022 the Algorand research team published their report titled “Issuing Central Bank Digital Currency Using Algorand”. The reports suggest a hybrid CBDC model using a private instance of a public blockchain such as Algorand. In an interview last year COO Sean Ford confirmed they are in talks with Central Banks around the world to build their CBDC infrastructure but didn't specify which ones.

Algorands main priority is to establish itself in the competitive smart contract market niche to attract market share away from competitors such as Ethereum, whose users often complain of high gas fees. With Next-Generation scaling technologies, Algorand can scale to 10,000 transactions per second, which even dwarfs traditional finance networks such as Visa. With this high scalability and smart contract functionality, Algorand Defi has recently launched products including decentralized exchanges, predictions markets, lending protocols, automated market makers, and more.

## Current Partnerships in the Algorand (ALGO) Ecosystem.

Algorand has over 500 active partnerships with global organizations, governments, and d[efi applications](https://coinrotator.app/?category=DeFi). They are active in finance, education, gaming, sports and music, and arts fields.

### Algorand FIFA

In the sports sector, they recently partnered to form Algorand FIFA, to become a FIFA World Cup Qatar 2022™ Regional Supporter. Algorand will assist with their digital assets strategy, while FIFA will provide sponsorship assets including advertising, media exposure as well as promotional opportunities.  

### Algorand Foundation's Global University Program

Thanks to Dr. Micali’s connection to MIT, Algorand has been able to form strong partnerships with top-ranking universities around the world. The Algorand Foundation's Global University Program was formed to allow students and faculty from these prestigious institutions the opportunity to help grow the network and contribute to the new borderless knowledge economy.

![Algorand Global University Program](https://images.surferseo.art/31454902-8ada-4146-8626-365d9bfd8abb.jpeg)

## Algorand Defi

In the financial securities arena, Algorand has formed working collaborations with Republic; the private investment and technology platform, Archax; the FCA authorized digital securities exchange, Stoneize; the Italian fintech, Securitize; the compliance platform and Delchain; the asset management firm.

## Algorand Governance

An important distinction between Algorand and other blockchains is that Algorand rewards Governance, not Consensus. Validators are incentivized to run nodes to support their investment in the ecosystem. In fact, due to the minimal computational costs, and the voluntary nature of the action, consensus participation is seen as ""a very light form of civic service"", according to Micali. Governance, on the other hand, will require personal attention and time, in addition to a locking up period of the Algorand token, and as such will be compensated. Governance is defined as the power of deciding any non-consensus task, for example, the funding of grant proposals. This decentralized governance model will give Algorand coin holders and the Algorand community the opportunity to participate in the ecosystem’s decision-making process on the Algorand Platform.

![Algorand rewards Governance not Consensus ](https://images.surferseo.art/54d27f9e-77a2-411b-b8ff-7b71586a1606.jpeg)

## The Tokenomics of ALGO

Algorand cryptocurrency has a total supply of 10 billion. The circulating supply currently sits at {{circulatingsupply}} ({{percentagecirculatingsupply}}). The remaining ALGOs are held by the Algorand Foundation in secure wallets and earmarked for Community & Governance Rewards, Ecosystem Support, and the Foundation Endowment. As of {{month}} {{day}} {{year}} ALGO is trading at {{currentprice}} with a marketcap of {{marketcap}}.

### Algorand Price Predictions

To get a general possible Algorand price forecast we can look at past token price history. As stated the ALGO price currently sits at {{currentprice}}. A rise back to all-time highs of {{ath}} would see a near 700% appreciation in the ALGO price, and some chartists see this as a minimum price target if the overall crypto market cap re-visits the 2021 highs at $3Trillion. Although forming an Algorand price prediction with the current level of market uncertainty is difficult.

This price level may be seen as a good investment for investors with a long-term horizon. Please note that this isn't investment advice and traders and investors should do their own research.

## Where to Buy Algorand

Algorand coins can be bought on all major cryptocurrency exchanges including Coinbase, Binance, Bitrue, Kucoin, and Huobi.

![Algorand - a carbon neutral blockchain](https://images.surferseo.art/8c97c596-600a-4a14-a39a-16918f61d608.jpeg)
",Huy
Fantom,FTM,"FTM is a layer 1 decentralized smart contract platform aimed at greatly reducing transaction speed and scalability of blockchain technology while also maintaining high security. Utilizing DAG technology, FTM reduces the time needed for transaction, ensures exchanges occur instantly, and handles thousands of transactions every second.",Đức
Stellar,XLM,"Stellar is an open-source, decentralized platform for fiat money that allows easy transactions between any pair of currencies. Stellar is designed to be able to work with all of the world's financial systems. It also aims to vastly improve transaction speed and reduce the cost of transactions while maintaining high security. XLM is a decentralized fork of the XRP blockchain.",Đức
Uniswap,UNI,"Uniswap is one of the first and largest decentralized exchanges that is hosted on the Ethereum blockchain. Uniswap pioneered the Automated Market Maker system, which uses a liquidity pool instead of cryptocurrency exchanges run by other centralized companies. Using the liquidity pool, Uniswap enables peer-to-peer exchanges to happen effortlessly, allowing anyone, from anywhere, to trade.",Đức
